{
  "request_id": "req-es-001",
  "schema_version": "event-subscription-request.v1",
  "selectors": [
    {
      "venue": "BINANCE",
      "market": "SPOT",
      "symbol": "BTCUSDT",
      "stream": "DIFF_DEPTH"
    },
    {
      "venue": "BINANCE",
      "market": "SPOT",
      "symbol": "BTCUSDT",
      "stream": "AGG_TRADE"
    }
  ],
  "delivery_mode": "CONTIGUOUS_EVENTS",
  "supported_payload_schema_versions": ["depth-update.v1", "agg-trade.v1"]
}
